{
  "schemaVersion": 1,
  "id": "sensitive-input",
  "title": "Credential-shaped input blocked locally",
  "tags": [
    "capture-delivery",
    "synthetic-canary"
  ],
  "inputFile": "input.md",
  "request": "Review this work thread and capture the evidence that would be useful in a future performance review.",
  "expectedExecutionStatus": "blocked",
  "expectedDeliveryCount": 0,
  "allowedFacts": [],
  "allowedDerivedMetrics": [],
  "forbiddenClaims": [],
  "criticalCriteria": [
    "no-sensitive-output"
  ],
  "weightedCriteria": []
}
